{
  "$schema": "http://json-schema.org/schema#",
  "type": "object",
  "properties": {
    "version": {
      "type": "integer"
    },
    "name": {
      "type": "string"
    },
    "items": {
      "type": "array",
      "items": {
        "type": "string"
      }
    },
    "items_opt": {
      "type": ["array", "null"]
    },
    "attr": {
      "type": "object",
      "properties": {
        "title": {
          "type": "string"
        },
        "porter": {
          "type": "array",
          "items": {
            "type": "string",
            "enum": [
              "Christian_Haitian",
              "Cebion",
              "romadu",
              "Johnny on Flame",
              "Bamboozler",
              "kloptops",
              "Overflask",
              "Nuxx",
              "Jetup",
              "Tekkenfede",
              "nl255",
              "Orson",
              "Slayer366",
              "krishenriksen",
              "brooksytech",
              "jtothebell",
              "TheGammaSqueeze",
              "Snoopy",
              "tabreturn",
              "mattyj513",
              "MadShmupper",
              "Shark",
              "Jeod",
              "wesam",
              "Fraxinus88",
              "Kompaan",
              "Joyrider3774",
              "JanTrueno",
              "Troidem",
              "Consumerism",
              "MegaStriker",
              "Pridetoons",
              "nkahoang",
              "fexofenadine",
              "Damian2809",
              "Zehmaluco",
              "Black_Hand",
              "nate_____",
              "Slobters",
              "kotzebuedog",
              "Ganimoth",
              "Doronimmo",
              "BinaryCounter",
              "NotYourAveragePaladin"
            ]
          }
        },
        "desc": {
          "type": "string"
        },
        "desc_md": {
          "type": ["null", "string"]
        },
        "inst": {
          "type": "string"
        },
        "inst_md": {
          "type": ["null", "string"]
        },
        "genres": {
          "type": "array",
          "items": {
            "type": "string",
            "enum": [
              "action",
              "adventure",
              "arcade",
              "casino/card",
              "fps",
              "platformer",
              "puzzle",
              "racing",
              "rhythm",
              "rpg",
              "simulation",
              "sports",
              "strategy",
              "visual novel",
              "other"
            ]
          }
        },
        "image": {
          "anyOf": [
            {
              "type": "null"
            },
            {
              "type": "object",
              "properties": {
                "screenshot": {
                  "type": "string"
                },
                "covers": {
                  "type": "array",
                  "items": {
                    "type": "string"
                  }
                },
                "thumbnail": {
                  "type": "null"
                },
                "video": {
                  "type": "null"
                }
              }
            }
          ]
        },
        "rtr": {
          "type": "boolean"
        },
        "exp": {
          "type": "boolean"
        },
        "runtime": {
          "anyOf": [
            {
              "type": "null"
            },
            {
              "type": "array",
              "items": {
                "type": "string",
                "enum": [
                  "mesa_pkg_0.1.squashfs",
                  "mono-6.12.0.122-aarch64.squashfs",
                  "pyxel_2.2.8_python_3.11.squashfs",
                  "renpy_8.3.4.squashfs",
                  "rlvm.squashfs",
                  "solarus-1.6.5.squashfs",
                  "weston_pkg_0.2.squashfs",
                  "frt_2.1.6.squashfs",
                  "frt_3.0.6_v1.squashfs",
                  "frt_3.1.2.squashfs",
                  "frt_3.2.3.squashfs",
                  "frt_3.3.4.squashfs",
                  "frt_3.4.5.squashfs",
                  "frt_3.5.2.squashfs",
                  "frt_3.6.squashfs",
                  "frt_4.0.4.squashfs",
                  "frt_4.1.3.squashfs",
                  "zulu11.48.21-ca-jdk11.0.11-linux.aarch64.squashfs",
                  "zulu17.48.15-ca-jdk17.0.10-linux.aarch64.squashfs",
                  "zulu17.54.21-ca-jre17.0.13-linux.squashfs"
                ]
              }
            }
          ]
        },
        "reqs": {
          "anyOf": [
            {
              "type": "null"
            },
            {
              "type": "array",
              "items": {
                "type": "string"
              }
            }
          ]
        },
        "arch": {
          "type": "array",
          "items": {
            "type": "string"
          }
        },
        "min_glibc": {
          "type": "string"
        },
        "store": {
          "anyOf": [
            {
              "type": "null"
            },
            {
              "type": "array",
              "items": {
                "type": "object",
                "properties": {
                  "name": {
                    "type": "string"
                  },
                  "gameurl": {
                    "type": "string"
                  },
                  "developerurl": {
                    "type": "string"
                  },
                  "url": {
                    "type": "string"
                  }
                },
                "required": ["name", "gameurl"]
              }
            }
          ]
        },
        "availability": {
          "type": "string"
        },
        "free": {
          "type": "boolean"
        }
      },
      "required": [
        "arch",
        "desc",
        "desc_md",
        "exp",
        "genres",
        "image",
        "inst",
        "min_glibc",
        "porter",
        "reqs",
        "rtr",
        "title"
      ]
    }
  },
  "required": ["version", "name", "attr", "items", "items_opt"]
}
