{
  "version": 4,
  "name": "alwayssurrender.zip",
  "items": [
    "Always Surrender.sh",
    "alwayssurrender"
  ],
  "items_opt": [],
  "attr": {
    "title": "Always Surrender",
    "porter": [
      "Ganimoth"
    ],
    "desc": "Always Surrender is a vertically scrolling shoot 'em up score attack, with an emphasis on pushing your luck as far as you can. Last as long as possible against an endless horde of enemies and then surrender in order to bank the bonus. Giving up has never been so rewarding. Battle a never ending swarm of enemies, but be sure to surrender before you die...",
    "desc_md": null,
    "inst": "Purchase the game on Steam and copy all game files into the assets folder.",
    "inst_md": "Purchase the game on [Steam](https://store.steampowered.com/app/1434200/Always_Surrender/) and copy all game files into the `assets` folder.",
    "genres": [
      "action"
    ],
    "image": null,
    "rtr": false,
    "exp": false,
    "runtime": [],
    "store": [
      {
        "name": "Steam",
        "gameurl": "https://store.steampowered.com/app/1434200/Always_Surrender/",
        "developerurl": "https://store.steampowered.com/search/?developer=The%20Covert%20Sheep%20Example"
      }
    ],
    "availability": "paid",
    "reqs": [],
    "arch": [
      "aarch64"
    ],
    "min_glibc": ""
  }
}