{
  "version": 4,
  "name": "astoryaboutbirds.zip",
  "items": [
    "A Story About Birds.sh",
    "astoryaboutbirds"
  ],
  "items_opt": [],
  "attr": {
    "title": "A Story About Birds",
    "porter": [
      "Slobters"
    ],
    "desc": "The birds are coming back! So, gather some wood, some bird food, and build some amazing shelters. \nExplore Plumage Farm on a relaxing day, collect branches and seeds in form of a minigame that requires skill and get to know its inhabitants and regulars. \nHow will you use the day?",
    "desc_md": null,
    "inst": "Install port files. Buy game in Itch. Download \"asab-linux-v1.0.5.zip\" then extract file \"a-story-about-birds.arm64\" into \"ports\\astoryaboutbirds\" folder",
    "inst_md": null,
    "genres": [
      "adventure",
      "rhythm"
    ],
    "image": null,
    "rtr": false,
    "exp": false,
    "runtime": [
      "weston_pkg_0.2.squashfs"
    ],
    "store": [
      {
        "name": "Itch.io",
        "gameurl": "https://partnano.itch.io/a-story-about-birds",
        "developerurl": "https://partnano.itch.io/"
      }
    ],
    "availability": "paid",
    "reqs": [],
    "arch": [],
    "min_glibc": ""
  }
}