{
  "version": 4,
  "name": "donthide.zip",
  "items": [
    "Dont Hide.sh",
    "donthide"
  ],
  "items_opt": [],
  "attr": {
    "title": "Don't Hide",
    "porter": [
      "NotYourAveragePaladin"
    ],
    "desc": "Trapped in a maze with a beast, you must find five keys and their door to escape. The monster can only smell and hear you, but as long as it hasn't fully caught your scent, you can move freely.",
    "desc_md": null,
    "inst": "Download the game For Free from Steam: https://store.steampowered.com/app/2131620/Dont_Hide/\nOr\nFrom Itch.io:\nhttps://sulfic-games.itch.io/dont-hide\nand Copy the DontHideGame.pck file into the gamedata folder",
    "inst_md": null,
    "genres": [
      "strategy"
    ],
    "image": null,
    "rtr": false,
    "exp": false,
    "runtime": [
      "frt_3.3.4.squashfs"
    ],
    "store": [
      {
        "name": "Steam",
        "gameurl": "https://store.steampowered.com/app/2131620/Dont_Hide/",
        "developerurl": "https://store.steampowered.com/search/?developer=Sulfic%20Games"
      },
      {
        "name": "itch.io",
        "gameurl": "https://sulfic-games.itch.io/dont-hide",
        "developerurl": "https://sulfic-games.itch.io/"
      }
    ],
    "availability": "free",
    "reqs": [],
    "arch": [],
    "min_glibc": ""
  }
}